<?xml version="1.0" encoding="UTF-8"?>
<notes xmlns:xsi="http://www.w3.org/2001/XMLSchema-instance" xsi:noNamespaceSchemaLocation="./notes_schema.xsd">
    <!--Hayley Dodkins u21528790-->
    <note id="1">
        <author>Tom Nook</author>
        <content>You're island needs some work.</content>
    </note>
    <note id="2">
        <author>Test Subject 234</author>
        <content>The cake is a lie.</content>
    </note>
    <note id="3">
        <author>Mooncake</author>
        <content>Chookity Dookity.</content>
    </note>
</notes>